{
  "$schema": "https://json-schema.org/draft/2020-12/schema",
  "$id": "https://vanta.dev/schemas/bundle-manifest.schema.json",
  "title": "VANTA full release zip manifest",
  "description": "Describes one full release zip (VantaClient-<version>-Release.zip): the published files of one client release and one launcher release plus the repository documentation, bundled by .github/workflows/bundle.yml from the already published GitHub Release files. Stored in shared/releases/bundles/vanta-<version>.json, a folder the release-manifest readers (shared/releases/*.json) never see. file.downloadUrl, file.size and file.sha256 are filled in by the workflow from the real zip; an empty downloadUrl means 'not published yet'. contents lists every file inside the zip except its SHA256SUMS.txt, in zip order, with paths relative to the zip's top-level folder.",
  "type": "object",
  "required": [
    "schemaVersion",
    "kind",
    "version",
    "clientVersion",
    "launcherVersion",
    "minecraftVersion",
    "releaseDate",
    "channel",
    "file",
    "contents"
  ],
  "additionalProperties": false,
  "properties": {
    "schemaVersion": {
      "description": "Manifest schema version. Only 1 exists.",
      "const": 1
    },
    "kind": {
      "description": "Tells a bundle manifest from a release manifest. Always \"bundle\".",
      "const": "bundle"
    },
    "version": {
      "description": "Version of the bundle (the tag is v<version>). Usually the version both products share.",
      "type": "string",
      "pattern": "^(0|[1-9]\\d*)\\.(0|[1-9]\\d*)\\.(0|[1-9]\\d*)(-[0-9A-Za-z.-]+)?$"
    },
    "clientVersion": {
      "description": "Version of the bundled VANTA Client release (shared/releases/client-<clientVersion>.json).",
      "type": "string",
      "pattern": "^(0|[1-9]\\d*)\\.(0|[1-9]\\d*)\\.(0|[1-9]\\d*)(-[0-9A-Za-z.-]+)?$"
    },
    "launcherVersion": {
      "description": "Version of the bundled VANTA Launcher release (shared/releases/launcher-<launcherVersion>.json).",
      "type": "string",
      "pattern": "^(0|[1-9]\\d*)\\.(0|[1-9]\\d*)\\.(0|[1-9]\\d*)(-[0-9A-Za-z.-]+)?$"
    },
    "minecraftVersion": {
      "description": "Minecraft Java Edition version the bundled client targets (copied from the client manifest).",
      "type": "string",
      "pattern": "^\\d+\\.\\d+(\\.\\d+)?$"
    },
    "releaseDate": {
      "description": "Date the zip was published as YYYY-MM-DD (UTC).",
      "type": "string",
      "format": "date",
      "pattern": "^\\d{4}-\\d{2}-\\d{2}$"
    },
    "channel": {
      "description": "stable when both component releases are stable, otherwise beta.",
      "enum": ["stable", "beta"]
    },
    "file": {
      "description": "The zip itself as attached to the GitHub Release v<version>.",
      "type": "object",
      "required": ["name", "downloadUrl", "size", "sha256"],
      "additionalProperties": false,
      "properties": {
        "name": {
          "description": "File name of the zip: VantaClient-<version>-Release.zip.",
          "type": "string",
          "pattern": "^VantaClient-[0-9A-Za-z.-]+-Release\\.zip$"
        },
        "downloadUrl": {
          "description": "Absolute https URL, or an empty string while the zip is not published.",
          "type": "string",
          "pattern": "^(https://[^\\s]+)?$"
        },
        "size": {
          "description": "Size of the zip in bytes (0 while unpublished).",
          "type": "integer",
          "minimum": 0
        },
        "sha256": {
          "description": "Lower-case hex SHA-256 digest of the zip, or an empty string while unpublished.",
          "type": "string",
          "pattern": "^([a-f0-9]{64})?$"
        }
      }
    },
    "contents": {
      "description": "Every file inside the zip except SHA256SUMS.txt, in zip order, paths relative to the top-level folder.",
      "type": "array",
      "minItems": 1,
      "items": { "$ref": "#/$defs/bundledFile" }
    }
  },
  "$defs": {
    "bundledFile": {
      "type": "object",
      "required": ["path", "size", "sha256"],
      "additionalProperties": false,
      "properties": {
        "path": {
          "description": "Path inside the top-level folder with '/' separators, no leading slash, no '.' or '..' segments (for example client/vanta-client-1.3.0.jar).",
          "type": "string",
          "minLength": 1,
          "maxLength": 255,
          "pattern": "^[A-Za-z0-9][A-Za-z0-9._+-]*(/[A-Za-z0-9][A-Za-z0-9._+-]*)*$"
        },
        "size": {
          "description": "Uncompressed size in bytes. Every bundled file is non-empty.",
          "type": "integer",
          "minimum": 1
        },
        "sha256": {
          "description": "Lower-case hex SHA-256 digest of the uncompressed file.",
          "type": "string",
          "pattern": "^[a-f0-9]{64}$"
        }
      }
    }
  }
}
